{
  "schemaVersion": 1,
  "stage": "stage-5b-entrypoint-cutover",
  "capturedAt": "2026-08-06T08:27:52.219Z",
  "run": {
    "id": "stage5b-20260806t082542z-c270e179",
    "logRoot": "evidence/stage-5b-cutover-run",
    "temporaryRoot": "/private/var/folders/gb/4tst5hyd1575hz7hknb6w5b00000gn/T/devenv-stage5b-stage5b-20260806t082542z-c270e179",
    "isolatedHome": "/private/var/folders/gb/4tst5hyd1575hz7hknb6w5b00000gn/T/devenv-stage5b-stage5b-20260806t082542z-c270e179/home",
    "originPath": "/Users/mrcr/Code/templates/devenv"
  },
  "source": {
    "baseSha": "9b7e0576c4e360c25291ad84190cd3bec3e3d9b2",
    "implementationSha": "c270e179af6408b74fee2b518487e5a3575d280f",
    "treeClean": true
  },
  "host": {
    "os": "darwin",
    "architecture": "arm64",
    "kernel": "25.5.0",
    "home": "/Users/mrcr",
    "dockerVersion": "29.4.0",
    "devcontainerCliVersion": "0.87.0",
    "pythonVersion": "3.12.8",
    "hostBunPresent": true
  },
  "precondition": {
    "mainCheckoutContainerReady": false,
    "checkReadyExitCode": 1
  },
  "journey": {
    "clonePath": "/private/var/folders/gb/4tst5hyd1575hz7hknb6w5b00000gn/T/devenv-stage5b-stage5b-20260806t082542z-c270e179/clone",
    "workspaceId": "devenv-main",
    "family": "main",
    "offset": 0,
    "publishedHostPort": 8080,
    "directUrl": "http://127.0.0.1:8080",
    "containerId": "90d63ad407d379bb9b1e124a11868c311d6756917123b5fe2b69c96a7e77b1c3",
    "devcontainerId": "16kmcp2vr26jdte0r45g86jregg9ukds5tlnutc12s2fha17veag",
    "definitionFingerprint": "d6ff95c907fd7c44a4e8ddb11fbdecf434a468a19c1fb6e2d9fe94ba76588654",
    "hookExecutionOs": "Linux",
    "hookContainerId": "90d63ad407d379bb9b1e124a11868c311d6756917123b5fe2b69c96a7e77b1c3"
  },
  "commands": [
    {
      "id": "cutover-guard",
      "command": [
        "bun",
        "run",
        "worktree:check"
      ],
      "runId": "stage5b-20260806t082542z-c270e179",
      "startedAt": "2026-08-06T08:25:42.153Z",
      "completedAt": "2026-08-06T08:25:42.267Z",
      "durationMs": 114,
      "stdoutPath": "evidence/stage-5b-cutover-run/cutover-guard.stdout",
      "stderrPath": "evidence/stage-5b-cutover-run/cutover-guard.stderr",
      "stdoutSha256": "b8fc787fad0cc3f993f929092349ec69500a2a05c0162ba2b0fa03d85e0fb54c",
      "stderrSha256": "b21172c02c58cf08110b00d513cdbce996f4ccd7813f16729358cd34cb9daad7",
      "exitCode": 0,
      "status": "pass"
    },
    {
      "id": "hermetic-selftest",
      "command": [
        "bash",
        "scripts/worktree/selftest.sh"
      ],
      "runId": "stage5b-20260806t082542z-c270e179",
      "startedAt": "2026-08-06T08:25:42.270Z",
      "completedAt": "2026-08-06T08:25:44.035Z",
      "durationMs": 1765,
      "stdoutPath": "evidence/stage-5b-cutover-run/hermetic-selftest.stdout",
      "stderrPath": "evidence/stage-5b-cutover-run/hermetic-selftest.stderr",
      "stdoutSha256": "84914daac0da2764842c72f3045b401080365704941d1d6653c9c71be59a9ba9",
      "stderrSha256": "e3b0c44298fc1c149afbf4c8996fb92427ae41e4649b934ca495991b7852b855",
      "exitCode": 0,
      "status": "pass"
    },
    {
      "id": "cutover-known-bad-fixtures",
      "command": [
        "bun",
        "test",
        "scripts/template/__tests__/worktree.test.ts"
      ],
      "runId": "stage5b-20260806t082542z-c270e179",
      "startedAt": "2026-08-06T08:25:44.035Z",
      "completedAt": "2026-08-06T08:26:58.703Z",
      "durationMs": 74668,
      "stdoutPath": "evidence/stage-5b-cutover-run/cutover-known-bad-fixtures.stdout",
      "stderrPath": "evidence/stage-5b-cutover-run/cutover-known-bad-fixtures.stderr",
      "stdoutSha256": "ca35b94f2c5b623fccbd1cc9e77eef3e30a6fcf4b045842fc1353f7ae6d8ea32",
      "stderrSha256": "fa75b0874452c678d62754886a3d44114d0f9514e61e9952465997a04d1c2a46",
      "exitCode": 0,
      "status": "pass"
    },
    {
      "id": "template-known-bad-fixtures",
      "command": [
        "bun",
        "test",
        "scripts/template/__tests__/template.test.ts",
        "-t",
        "residue"
      ],
      "runId": "stage5b-20260806t082542z-c270e179",
      "startedAt": "2026-08-06T08:26:58.703Z",
      "completedAt": "2026-08-06T08:26:59.645Z",
      "durationMs": 942,
      "stdoutPath": "evidence/stage-5b-cutover-run/template-known-bad-fixtures.stdout",
      "stderrPath": "evidence/stage-5b-cutover-run/template-known-bad-fixtures.stderr",
      "stdoutSha256": "2049f6899d4e06caaf484eef3a174a0c285665a64df7e774277932356739ca7a",
      "stderrSha256": "17df9cd628704ae44316a01453d99ddd3189d22d3ab1858cf06a1a74159f1d3a",
      "exitCode": 0,
      "status": "pass"
    },
    {
      "id": "legacy-orchestration-scan",
      "command": [
        "bun",
        "scripts/template/collect-stage-five-b-evidence.ts",
        "scan-legacy"
      ],
      "runId": "stage5b-20260806t082542z-c270e179",
      "startedAt": "2026-08-06T08:26:59.645Z",
      "completedAt": "2026-08-06T08:26:59.690Z",
      "durationMs": 45,
      "stdoutPath": "evidence/stage-5b-cutover-run/legacy-orchestration-scan.stdout",
      "stderrPath": "evidence/stage-5b-cutover-run/legacy-orchestration-scan.stderr",
      "stdoutSha256": "972c3e4c56d08b5a03475a3ebeba3920e696b05b4ecfc64c4fab4cc3ebf168d5",
      "stderrSha256": "e3b0c44298fc1c149afbf4c8996fb92427ae41e4649b934ca495991b7852b855",
      "exitCode": 0,
      "status": "pass"
    },
    {
      "id": "journey-fresh-clone",
      "command": [
        "bash",
        "-c",
        "set -euo pipefail\nexport HOME=\"/private/var/folders/gb/4tst5hyd1575hz7hknb6w5b00000gn/T/devenv-stage5b-stage5b-20260806t082542z-c270e179/home\"\nmkdir -p \"$HOME\"\ngit clone --quiet \"/Users/mrcr/Code/templates/devenv\" \"/private/var/folders/gb/4tst5hyd1575hz7hknb6w5b00000gn/T/devenv-stage5b-stage5b-20260806t082542z-c270e179/clone\"\ncd \"/private/var/folders/gb/4tst5hyd1575hz7hknb6w5b00000gn/T/devenv-stage5b-stage5b-20260806t082542z-c270e179/clone\"\ngit checkout --quiet --detach c270e179af6408b74fee2b518487e5a3575d280f\ngit config user.name \"Stage 5B journey\"\ngit config user.email \"stage-5b-journey@example.invalid\"\ngit config commit.gpgsign false\nprintf 'headSha=%s\\n' \"$(git rev-parse HEAD)\"\nprintf 'gitDir=%s\\n' \"$(git rev-parse --path-format=absolute --git-dir)\"\nprintf 'statusLines=%s\\n' \"$(git status --porcelain | wc -l | tr -d ' ')\"\nprintf 'hooksPath=%s\\n' \"$(git config --get core.hooksPath || printf none)\"\nprintf 'huskyRunnerPresent=%s\\n' \"$([ -e .husky/_/h ] && printf present || printf absent)\"\nprintf 'generatedStatePresent=%s\\n' \"$([ -e .dev ] && printf present || printf absent)\"\nprintf 'nodeModulesPresent=%s\\n' \"$([ -e node_modules ] && printf present || printf absent)\"\nprintf 'bridgeExecutable=%s\\n' \"$([ -x scripts/worktree/exec.sh ] && printf true || printf false)\"\nprintf 'commitMsgRoutes=%s\\n' \"$(grep -c 'exec.sh --require-ready' .husky/commit-msg | tr -d ' ')\"\nprintf 'preCommitRoutes=%s\\n' \"$(grep -c 'exec.sh --require-ready' .husky/pre-commit | tr -d ' ')\""
      ],
      "runId": "stage5b-20260806t082542z-c270e179",
      "startedAt": "2026-08-06T08:26:59.690Z",
      "completedAt": "2026-08-06T08:27:01.823Z",
      "durationMs": 2133,
      "stdoutPath": "evidence/stage-5b-cutover-run/journey-fresh-clone.stdout",
      "stderrPath": "evidence/stage-5b-cutover-run/journey-fresh-clone.stderr",
      "stdoutSha256": "037f83890a5614679fb9d23ab14d08caab8e1d934a4ad5ecb0c1e1e7e8ced707",
      "stderrSha256": "e3b0c44298fc1c149afbf4c8996fb92427ae41e4649b934ca495991b7852b855",
      "exitCode": 0,
      "status": "pass"
    },
    {
      "id": "journey-prerequisites",
      "command": [
        "bash",
        "-c",
        "set -euo pipefail\nmain_state_digest() {\n\t(cd \"/Users/mrcr/.config/devcontainer\" 2>/dev/null &&\n\t\tfind ports-registry worktrees caddy -type f -print0 2>/dev/null |\n\t\tsort -z | xargs -0 shasum -a 256 2>/dev/null || true) |\n\t\tshasum -a 256 | awk '{ print $1 }'\n}\nprintf 'mainCheckoutStateDigest=%s\\n' \"$(main_state_digest)\"\nstatus=0\n(cd \"/Users/mrcr/Code/templates/devenv\" && HOME=\"/Users/mrcr\" bash scripts/worktree/ensure.sh --check-ready) >/dev/null 2>&1 || status=$?\nprintf 'mainCheckoutReadyExitCode=%s\\n' \"$status\"\nexport HOME=\"/private/var/folders/gb/4tst5hyd1575hz7hknb6w5b00000gn/T/devenv-stage5b-stage5b-20260806t082542z-c270e179/home\"\nexport DOCKER_CONFIG=\"/Users/mrcr/.docker\"\nfor directory in secrets.d container-env codex-auth; do\n\tmkdir -p \"$HOME/.config/devcontainer/$directory\"\n\tchmod 700 \"$HOME/.config/devcontainer/$directory\"\ndone\nmkdir -p \"$HOME/.ssh\"\nchmod 700 \"$HOME/.ssh\"\nprintf 'isolatedHome=%s\\n' \"$HOME\"\nprintf 'hostDirectories=%s\\n' \"$(ls \"$HOME/.config/devcontainer\" | sort | tr '\\n' ' ')\"\nprintf 'dockerVersion=%s\\n' \"$(docker version --format '{{.Server.Version}}')\"\nprintf 'containerCliVersion=%s\\n' \"$(devcontainer --version)\"\nprintf 'pythonVersion=%s\\n' \"$(python3 -c 'import platform; print(platform.python_version())')\"\nprintf 'hostBunPresent=%s\\n' \"$(command -v bun >/dev/null 2>&1 && printf true || printf false)\"\ncd \"/private/var/folders/gb/4tst5hyd1575hz7hknb6w5b00000gn/T/devenv-stage5b-stage5b-20260806t082542z-c270e179/clone\"\nbash -n init-host.sh\nprintf 'initHostSyntax=ok\\n'\nprintf 'initHostInstallsContainerCli=%s\\n' \"$(grep -c 'brew install devcontainer' init-host.sh | tr -d ' ')\"\nprintf 'initHostVerifiesPython=%s\\n' \"$(grep -c 'python3' init-host.sh | tr -d ' ')\""
      ],
      "runId": "stage5b-20260806t082542z-c270e179",
      "startedAt": "2026-08-06T08:27:01.823Z",
      "completedAt": "2026-08-06T08:27:02.101Z",
      "durationMs": 278,
      "stdoutPath": "evidence/stage-5b-cutover-run/journey-prerequisites.stdout",
      "stderrPath": "evidence/stage-5b-cutover-run/journey-prerequisites.stderr",
      "stdoutSha256": "125b231cbac9c7de1888251e236972ed5b8e939701a94e5618adb41c8f779779",